<?xml version="1.0" encoding="UTF-8"?>
<xsd:schema elementFormDefault="qualified" xmlns:xsd="http://www.w3.org/2001/XMLSchema">

    <xsd:include schemaLocation="types/base.xsd"/>

    <xsd:element name="edges" type="edgesType">
        <xsd:key name="edgeKey">
            <xsd:selector xpath="edge"/>
            <xsd:field xpath="@id"/>
        </xsd:key>
    </xsd:element>

    <xsd:complexType name="edgesType">
        <xsd:choice minOccurs="0" maxOccurs="unbounded">
            <xsd:element name="location" type="locationType" maxOccurs="1"/>
            <xsd:element name="edge" type="edgeType"/>
            <xsd:element name="roundabout" type="roundaboutType"/>
            <xsd:element name="delete" type="deleteType"/>
        </xsd:choice>
        <xsd:attribute name="version" use="optional">
            <xsd:simpleType>
                <xsd:restriction base="xsd:string">
                    <xsd:pattern value="\d+.\d+"/>
                </xsd:restriction>
            </xsd:simpleType>
        </xsd:attribute>
    </xsd:complexType>

    <xsd:complexType name="edgeType">
        <xsd:choice minOccurs="0" maxOccurs="unbounded">
            <xsd:element name="lane" type="laneType" minOccurs="0" maxOccurs="unbounded"/>
            <xsd:element name="split" type="splitType" minOccurs="0" maxOccurs="unbounded"/>
            <xsd:element name="neigh" type="neighType" minOccurs="0" maxOccurs="unbounded"/>
            <xsd:element name="stopOffset" type="stopOffsetType" minOccurs="0" maxOccurs="1"/>
            <xsd:element name="param" type="paramType" minOccurs="0" maxOccurs="unbounded"/>
        </xsd:choice>
        <xsd:attribute name="id" type="idType" use="required"/>
        <xsd:attribute name="from" type="xsd:string" use="required"/>
        <xsd:attribute name="to" type="xsd:string" use="required"/>
        <xsd:attribute name="name" type="xsd:string" use="optional"/>
        <xsd:attribute name="priority" type="xsd:int" use="optional"/>
        <xsd:attribute name="type" type="xsd:string" use="optional"/>
        <xsd:attribute name="routingType" type="xsd:string" use="optional"/>
        <xsd:attribute name="numLanes" type="xsd:positiveInteger" use="optional"/>
        <xsd:attribute name="speed" type="positiveFloatType" use="optional"/>
        <xsd:attribute name="friction" type="positiveFloatType" use="optional"/>
        <xsd:attribute name="shape" type="shapeType" use="optional"/>
        <xsd:attribute name="spreadType" use="optional">
            <xsd:simpleType>
                <xsd:restriction base="xsd:string">
                    <xsd:enumeration value="center"/>
                    <xsd:enumeration value="roadCenter"/>
                    <xsd:enumeration value="right"/>
                </xsd:restriction>
            </xsd:simpleType>
        </xsd:attribute>
        <xsd:attribute name="length" type="positiveFloatType" use="optional"/>
        <xsd:attribute name="width" type="positiveFloatType" use="optional"/>
        <xsd:attribute name="endOffset" type="nonNegativeFloatType" use="optional"/>
        <xsd:attribute name="allow" type="xsd:string" use="optional"/>
        <xsd:attribute name="disallow" type="xsd:string" use="optional"/>
        <xsd:attribute name="distance" type="floatType"/>
        <xsd:attribute name="bidi" type="xsd:string" use="optional"/>
        <xsd:attribute name="sidewalkWidth" type="nonNegativeFloatType"/>
        <xsd:attribute name="bikeLaneWidth" type="nonNegativeFloatType"/>
        <!-- attributes for dlr-navteq.plain -->
        <xsd:attribute name="speedCategory" type="xsd:nonNegativeInteger" use="optional"/>
        <xsd:attribute name="speedRestriction" type="nonNegativeFloatType" use="optional"/>
        <xsd:attribute name="maxWidth" type="nonNegativeFloatType" use="optional"/>
        <xsd:attribute name="FRC" type="xsd:nonNegativeInteger" use="optional"/>
        <xsd:attribute name="vehicleTypeCode" type="xsd:string" use="optional"/>
        <xsd:attribute name="formOfWay" type="xsd:nonNegativeInteger" use="optional"/>
        <xsd:attribute name="isRamp" type="boolType" use="optional"/>
        <xsd:attribute name="brunnelType" type="xsd:integer" use="optional"/>
        <xsd:attribute name="postalCode" type="xsd:string" use="optional"/>
        <xsd:attribute name="surface" type="xsd:string" use="optional"/>
    </xsd:complexType>

    <xsd:complexType name="laneType">
        <xsd:choice minOccurs="0" maxOccurs="unbounded">
            <xsd:element name="neigh" type="neighType" minOccurs="0" maxOccurs="unbounded"/>
            <xsd:element name="stopOffset" type="stopOffsetType" minOccurs="0" maxOccurs="unbounded"/>
            <xsd:element name="param" type="paramType" minOccurs="0" maxOccurs="unbounded"/>
        </xsd:choice>
        <xsd:attribute name="index" type="xsd:nonNegativeInteger" use="required"/>
        <xsd:attribute name="allow" type="xsd:string" use="optional"/>
        <xsd:attribute name="disallow" type="xsd:string" use="optional"/>
        <xsd:attribute name="speed" type="positiveFloatType" use="optional"/>
        <xsd:attribute name="friction" type="positiveFloatType" use="optional"/>
        <xsd:attribute name="width" type="positiveFloatType" use="optional"/>
        <xsd:attribute name="prefer" type="xsd:string" use="optional"/>
        <xsd:attribute name="acceleration" type="boolType" use="optional"/>
        <xsd:attribute name="endOffset" type="nonNegativeFloatType" use="optional"/>
        <xsd:attribute name="shape" type="shapeType" use="optional"/>
        <xsd:attribute name="type" type="xsd:string" use="optional"/>
        <xsd:attribute name="changeRight" type="xsd:string" use="optional"/>
        <xsd:attribute name="changeLeft" type="xsd:string" use="optional"/>
    </xsd:complexType>

    <xsd:complexType name="deleteType">
        <xsd:attribute name="id" type="idType" use="required"/>
        <xsd:attribute name="index" type="xsd:nonNegativeInteger" use="optional"/>
    </xsd:complexType>

    <xsd:complexType name="roundaboutType">
        <xsd:attribute name="nodes" type="xsd:string" use="optional"/>
        <xsd:attribute name="edges" type="xsd:string" use="required"/>
    </xsd:complexType>

    <xsd:complexType name="neighType">
        <xsd:attribute name="lane" type="xsd:string" use="required"/>
    </xsd:complexType>

    <xsd:complexType name="stopOffsetType">
        <xsd:attribute name="value" type="nonNegativeFloatType" use="required"/>
        <xsd:attribute name="exceptions" type="xsd:string" use="optional"/>
        <xsd:attribute name="vClasses" type="xsd:string" use="optional"/>
    </xsd:complexType>

</xsd:schema>
