<?xml version="1.0" encoding="UTF-8"?>

<!-- generated on 2024-08-08 14:13:57 by Eclipse SUMO netedit Version v1_20_0+1772-b761cf9d6e3
<neteditConfiguration xmlns:xsi="http://www.w3.org/2001/XMLSchema-instance" xsi:noNamespaceSchemaLocation="http://sumo.dlr.de/xsd/neteditConfiguration.xsd">

    <input>
        <sumo-net-file value="D:\Netedit_dev\tests\netedit\processing\join_selected_junction\near_position\net.net.xml"/>
    </input>

    <processing>
        <geometry.min-radius.fix.railways value="false"/>
        <geometry.max-grade.fix value="false"/>
        <offset.disable-normalization value="true"/>
        <lefthand value="0"/>
    </processing>

    <junctions>
        <no-turnarounds value="true"/>
        <junctions.corner-detail value="5"/>
        <junctions.limit-turn-speed value="5.50"/>
        <rectangular-lane-cut value="0"/>
    </junctions>

    <pedestrian>
        <walkingareas value="0"/>
    </pedestrian>

</neteditConfiguration>
-->

<edges version="1.20" xmlns:xsi="http://www.w3.org/2001/XMLSchema-instance" xsi:noNamespaceSchemaLocation="http://sumo.dlr.de/xsd/edges_file.xsd">
    <location netOffset="0.00,0.00" convBoundary="-60.00,-30.00,60.00,30.00" origBoundary="-10000000000.000000,-10000000000.000000,10000000000.000000,10000000000.000000" projParameter="+proj=merc +a=6378137 +b=6378137 +lat_ts=0.0 +lon_0=0.0 +x_0=0.0 +y_0=0 +k=1.0 +units=m +nadgrids=@null +wktext +no_defs"/>

    <edge id="-E0" from="J1" to="J0" priority="-1" numLanes="1" speed="13.89" disallow="pedestrian"/>
    <edge id="-E1" from="J2" to="J1" priority="-1" numLanes="1" speed="13.89" disallow="pedestrian"/>
    <edge id="-E2" from="J3" to="J0" priority="-1" numLanes="1" speed="13.89" disallow="pedestrian"/>
    <edge id="-E3" from="J4" to="J0" priority="-1" numLanes="1" speed="13.89" disallow="pedestrian"/>
    <edge id="-E4" from="J6" to="J1" priority="-1" numLanes="1" speed="13.89" disallow="pedestrian"/>
    <edge id="-E5" from="J7" to="J1" priority="-1" numLanes="1" speed="13.89" disallow="pedestrian"/>
    <edge id="-E7" from="J9" to="J0" priority="-1" numLanes="1" speed="13.89" disallow="pedestrian"/>
    <edge id="E0" from="J0" to="J1" priority="-1" numLanes="1" speed="13.89" disallow="pedestrian"/>
    <edge id="E1" from="J1" to="J2" priority="-1" numLanes="1" speed="13.89" disallow="pedestrian"/>
    <edge id="E2" from="J0" to="J3" priority="-1" numLanes="1" speed="13.89" disallow="pedestrian"/>
    <edge id="E3" from="J0" to="J4" priority="-1" numLanes="1" speed="13.89" disallow="pedestrian"/>
    <edge id="E4" from="J1" to="J6" priority="-1" numLanes="1" speed="13.89" disallow="pedestrian"/>
    <edge id="E5" from="J1" to="J7" priority="-1" numLanes="1" speed="13.89" disallow="pedestrian"/>
    <edge id="E7" from="J0" to="J9" priority="-1" numLanes="1" speed="13.89" disallow="pedestrian"/>
    <edge id="EdgeExternBot" from="JunctionExtern0" to="JunctionExtern1" priority="-1" numLanes="1" speed="13.89" shape="-60.00,0.00 -45.00,0.00 -45.00,-25.00 -40.00,-30.00 40.00,-30.00 45.00,-25.00 45.00,0.00 60.00,0.00" length="175.00" width="3.00" disallow="pedestrian"/>
    <edge id="EdgeExternTop" from="JunctionExtern1" to="JunctionExtern0" priority="-1" numLanes="1" speed="13.89" shape="60.00,0.00 45.00,0.00 45.00,25.00 40.00,30.00 -40.00,30.00 -45.00,25.00 -45.00,0.00 -60.00,0.00" length="175.00" width="3.00" disallow="pedestrian"/>
</edges>
