<?xml version="1.0" encoding="UTF-8"?>

<!-- generated on 2024-07-01 08:42:09 by Eclipse SUMO netedit Version v1_20_0+1067-ecd6dc8927e
<neteditConfiguration xmlns:xsi="http://www.w3.org/2001/XMLSchema-instance" xsi:noNamespaceSchemaLocation="http://sumo.dlr.de/xsd/neteditConfiguration.xsd">

    <input>
        <sumo-net-file value="D:\Netedit_dev\tests\netedit\network\lanes\select_vtypes\allowed\aircraft\net.net.xml"/>
    </input>

    <processing>
        <geometry.min-radius.fix.railways value="false"/>
        <geometry.max-grade.fix value="false"/>
        <offset.disable-normalization value="true"/>
        <lefthand value="0"/>
    </processing>

    <junctions>
        <no-turnarounds value="true"/>
        <junctions.corner-detail value="5"/>
        <junctions.limit-turn-speed value="5.50"/>
        <rectangular-lane-cut value="0"/>
    </junctions>

    <pedestrian>
        <walkingareas value="0"/>
    </pedestrian>

</neteditConfiguration>
-->

<edges version="1.20" xmlns:xsi="http://www.w3.org/2001/XMLSchema-instance" xsi:noNamespaceSchemaLocation="http://sumo.dlr.de/xsd/edges_file.xsd">
    <edge id="-E44" from="J39" to="J38" priority="-1" numLanes="2" speed="13.89">
        <lane index="0" disallow="all"/>
        <lane index="1" allow="rail"/>
    </edge>
    <edge id="E44" from="J38" to="J39" priority="-1" numLanes="2" speed="13.89">
        <lane index="0" disallow="all"/>
        <lane index="1" allow="rail"/>
    </edge>
    <edge id="EdgeExternBot" from="JunctionExtern0" to="JunctionExtern1" priority="-1" numLanes="1" speed="13.89" shape="-60.00,0.00 -45.00,0.00 -45.00,-25.00 -40.00,-30.00 40.00,-30.00 45.00,-25.00 45.00,0.00 60.00,0.00" length="175.00" width="3.00" disallow="pedestrian"/>
    <edge id="EdgeExternTop" from="JunctionExtern1" to="JunctionExtern0" priority="-1" numLanes="1" speed="13.89" shape="60.00,0.00 45.00,0.00 45.00,25.00 40.00,30.00 -40.00,30.00 -45.00,25.00 -45.00,0.00 -60.00,0.00" length="175.00" width="3.00" disallow="pedestrian"/>
</edges>
