<?xml version="1.0" encoding="UTF-8"?>

<!-- generated on 2023-06-06 12:38:30 by Eclipse SUMO netconvert Version v1_17_0+0735-ed7251a
<configuration xmlns:xsi="http://www.w3.org/2001/XMLSchema-instance" xsi:noNamespaceSchemaLocation="http://sumo.dlr.de/xsd/netconvertConfiguration.xsd">

    <input>
        <sumo-net-file value="net.net.xml"/>
    </input>

    <output>
        <plain-output-prefix value="input_plain"/>
    </output>

    <processing>
        <geometry.min-radius.fix.railways value="false"/>
        <geometry.max-grade.fix value="false"/>
        <offset.disable-normalization value="true"/>
        <lefthand value="0"/>
    </processing>

    <junctions>
        <no-turnarounds value="true"/>
        <junctions.corner-detail value="5"/>
        <junctions.limit-turn-speed value="5.50"/>
        <rectangular-lane-cut value="0"/>
    </junctions>

    <pedestrian>
        <walkingareas value="0"/>
    </pedestrian>

</configuration>
-->

<edges version="1.16" xmlns:xsi="http://www.w3.org/2001/XMLSchema-instance" xsi:noNamespaceSchemaLocation="http://sumo.dlr.de/xsd/edges_file.xsd">
    <edge id="-E0" from="J1" to="J0" priority="-1" numLanes="1" speed="13.89" spreadType="center" allow="rail" bidi="E0"/>
    <edge id="-E1" from="J2" to="J1" priority="-1" numLanes="1" speed="13.89" spreadType="center" allow="rail" bidi="E1"/>
    <edge id="-E2" from="J1" to="J3" priority="-1" numLanes="1" speed="13.89" spreadType="center" allow="rail" bidi="E2"/>
    <edge id="-E3" from="J5" to="J4" priority="-1" numLanes="1" speed="13.89" spreadType="center" allow="rail" bidi="E3"/>
    <edge id="-E4" from="J6" to="J5" priority="-1" numLanes="1" speed="13.89" spreadType="center" allow="rail" bidi="E4"/>
    <edge id="-E5" from="J5" to="J7" priority="-1" numLanes="1" speed="13.89" spreadType="center" allow="rail" bidi="E5"/>
    <edge id="E0" from="J0" to="J1" priority="-1" numLanes="1" speed="13.89" spreadType="center" allow="rail" bidi="-E0"/>
    <edge id="E1" from="J1" to="J2" priority="-1" numLanes="1" speed="13.89" spreadType="center" allow="rail" bidi="-E1"/>
    <edge id="E2" from="J3" to="J1" priority="-1" numLanes="1" speed="13.89" spreadType="center" allow="rail" bidi="-E2"/>
    <edge id="E3" from="J4" to="J5" priority="-1" numLanes="1" speed="13.89" spreadType="center" allow="rail" bidi="-E3"/>
    <edge id="E4" from="J5" to="J6" priority="-1" numLanes="1" speed="13.89" spreadType="center" allow="rail" bidi="-E4"/>
    <edge id="E5" from="J7" to="J5" priority="-1" numLanes="1" speed="13.89" spreadType="center" allow="rail" bidi="-E5"/>
</edges>
